{
  "$id": "https://example.invalid/steuerboard/schemas/action-preflight-binding.v1.schema.json",
  "$schema": "https://json-schema.org/draft/2020-12/schema",
  "title": "Action Preflight Binding v1",
  "description": "Phase 8D.1 pure artifact-level binding assessment. Binds one git-pull-ff-only action-plan.v1 to one git-status-read-only run-evidence-chain.v1 without executing, mutating, or authorising actions.",
  "type": "object",
  "additionalProperties": false,
  "required": [
    "schema_version",
    "binding_id",
    "checked_at",
    "plan_ref",
    "plan_action",
    "chain_ref",
    "chain_action",
    "binding_state",
    "blocked_because",
    "checks",
    "source_refs",
    "boundary"
  ],
  "properties": {
    "schema_version": {
      "const": "action-preflight-binding.v1"
    },
    "binding_id": {
      "type": "string",
      "minLength": 1,
      "pattern": "^\\S(?:.*\\S)?$"
    },
    "checked_at": {
      "type": "string",
      "format": "date-time",
      "pattern": "^\\d{4}-\\d{2}-\\d{2}T\\d{2}:\\d{2}:\\d{2}Z$"
    },
    "plan_ref": {
      "type": "string",
      "minLength": 1,
      "pattern": "^\\S(?:.*\\S)?$"
    },
    "plan_action": {
      "type": "string",
      "minLength": 1,
      "pattern": "^\\S(?:.*\\S)?$"
    },
    "chain_ref": {
      "type": "string",
      "minLength": 1,
      "pattern": "^\\S(?:.*\\S)?$"
    },
    "chain_action": {
      "type": "string",
      "minLength": 1,
      "pattern": "^\\S(?:.*\\S)?$"
    },
    "binding_state": {
      "enum": [
        "binding_valid",
        "binding_invalid",
        "binding_inconclusive"
      ]
    },
    "blocked_because": {
      "type": "array",
      "items": {
        "enum": [
          "unsupported_plan_action",
          "unsupported_chain_action",
          "chain_invalid",
          "chain_redaction_unverified",
          "binding_material_missing",
          "binding_mismatch"
        ]
      }
    },
    "failure_reasons": {
      "type": "array",
      "minItems": 1,
      "items": {
        "type": "string",
        "minLength": 1,
        "pattern": "^\\S(?:.*\\S)?$"
      }
    },
    "checks": {
      "type": "array",
      "items": {
        "type": "object",
        "additionalProperties": false,
        "required": [
          "check",
          "passed"
        ],
        "properties": {
          "check": {
            "type": "string",
            "minLength": 1
          },
          "passed": {
            "type": "boolean"
          },
          "expected": {
            "type": "string"
          },
          "actual": {
            "type": "string"
          }
        }
      }
    },
    "source_refs": {
      "type": "array",
      "items": {
        "type": "string",
        "minLength": 1,
        "pattern": "^\\S(?:.*\\S)?$"
      }
    },
    "boundary": {
      "type": "object",
      "additionalProperties": false,
      "required": [
        "does_not_execute",
        "does_not_mutate",
        "does_not_authorise_actions"
      ],
      "properties": {
        "does_not_execute": {
          "const": true
        },
        "does_not_mutate": {
          "const": true
        },
        "does_not_authorise_actions": {
          "const": true
        }
      }
    }
  },
  "allOf": [
    {
      "if": {
        "properties": {
          "binding_state": {
            "const": "binding_valid"
          }
        },
        "required": [
          "binding_state"
        ]
      },
      "then": {
        "properties": {
          "blocked_because": {
            "maxItems": 0
          }
        },
        "not": {
          "required": [
            "failure_reasons"
          ]
        }
      }
    },
    {
      "if": {
        "properties": {
          "binding_state": {
            "const": "binding_invalid"
          }
        },
        "required": [
          "binding_state"
        ]
      },
      "then": {
        "required": [
          "failure_reasons"
        ],
        "properties": {
          "blocked_because": {
            "minItems": 1
          },
          "failure_reasons": {
            "minItems": 1
          }
        }
      }
    },
    {
      "if": {
        "properties": {
          "binding_state": {
            "const": "binding_inconclusive"
          }
        },
        "required": [
          "binding_state"
        ]
      },
      "then": {
        "required": [
          "failure_reasons"
        ],
        "properties": {
          "blocked_because": {
            "maxItems": 0
          },
          "failure_reasons": {
            "minItems": 1
          }
        }
      }
    }
  ]
}
