{
  "schema_version": "action-preflight-binding.v1",
  "binding_id": "preflight-binding-16a5c5ce51ecbffa2ac9fe06e56cd6df2dbe1cb020b9b7343a09b202fd6667e6",
  "checked_at": "2026-05-28T09:15:00Z",
  "plan_ref": "plan-switch-main-2026-05-23-001",
  "plan_action": "switch-main",
  "chain_ref": "chain-run-read-only-example-pilot-valid-001",
  "chain_action": "git-status-read-only",
  "binding_state": "binding_invalid",
  "blocked_because": [
    "unsupported_plan_action"
  ],
  "failure_reasons": [
    "unsupported_plan_action"
  ],
  "checks": [
    {
      "check": "plan_action_supported",
      "passed": false,
      "expected": "git-pull-ff-only",
      "actual": "switch-main"
    },
    {
      "check": "chain_action_supported",
      "passed": true,
      "expected": "git-status-read-only",
      "actual": "git-status-read-only"
    },
    {
      "check": "chain_status_valid",
      "passed": true,
      "expected": "valid",
      "actual": "valid"
    },
    {
      "check": "chain_redaction_verified",
      "passed": true,
      "expected": "true",
      "actual": "true"
    },
    {
      "check": "binding_basis_from_contract_fields",
      "passed": false,
      "expected": "chain.action=='switch-main' and chain.plan_ref=='plan-switch-main-2026-05-23-001'",
      "actual": "chain.action=='git-status-read-only' and chain.plan_ref=='plan-git-status-read-only-2026-05-26-001'"
    }
  ],
  "source_refs": [
    "git.current_branch",
    "action-plan.v1",
    "run-evidence-chain.v1"
  ],
  "boundary": {
    "does_not_execute": true,
    "does_not_mutate": true,
    "does_not_authorise_actions": true
  }
}
